{
  "schemaVersion": "1.0.0",
  "catalogKind": "public-source-backed",
  "policy": {
    "noMockProducts": true,
    "omitUnknownFieldsRatherThanInvent": true,
    "commercialFieldsRequireAuthoritativeSource": true
  },
  "products": [
    {
      "id": "account-erasure-with-write-fencing",
      "slug": "account-erasure-with-write-fencing",
      "name": "Account Erasure with Write Fencing",
      "productType": "skill",
      "category": "developer-tooling",
      "summary": "Erase an authorised account's indexed service data while invalidating stale sessions and fencing already admitted work from restoring deleted state.",
      "problem": "Successful deletion or session rejection alone can leave older in-flight work able to recreate records or credentials after the account is erased.",
      "coreOutcomes": [
        "Scoped deletion with separate registry and credential fences",
        "Consequence-time rejection of stale admitted writes",
        "Receipts and fresh indexed-state readback",
        "Synthetic race acceptance distinct from real customer cleanup"
      ],
      "requirements": [
        "Explicit account-deletion authority and identity confirmation",
        "Canonical indexed inventory and active-work state",
        "Generation or equivalent durable write guards",
        "Safe fixture isolation and post-deletion read access"
      ],
      "boundaries": [
        "Session invalidation alone does not prove stale-write rejection",
        "Indexed service deletion is not external-account or key revocation",
        "Unknown unindexed records retain their documented limitation",
        "A service receipt is not an independent verifier verdict"
      ],
      "tags": [
        "erasure",
        "account-lifecycle",
        "fencing",
        "race-conditions",
        "generation",
        "receipts"
      ],
      "sourcePath": "products/account-erasure-with-write-fencing/SKILL.md"
    },
    {
      "id": "agent-subcontracting-commercial-handoff",
      "slug": "agent-subcontracting-commercial-handoff",
      "name": "Agent Subcontracting Commercial Handoff",
      "productType": "skill",
      "category": "agent-commerce",
      "summary": "Publish a machine-readable subcontracting surface that lets agents discover a human service provider, submit bounded jobs, use only server-authoritative published packages, and keep receipt, acceptance, payment, execution and completion as separate states.",
      "problem": "Agents often attempt work beyond their competence while service businesses expose only human-facing contact pages or unsafe checkout inputs, making delegation, pricing authority and execution state ambiguous.",
      "coreOutcomes": [
        "Machine-readable service and procurement catalogue",
        "Structured bounded agent job intake",
        "Server-authoritative published package pricing",
        "Quote-first treatment for custom technical work",
        "Explicit separation of receipt, acceptance, payment, authority, execution and outcome",
        "Outside-in verification of the public subcontracting contract"
      ],
      "requirements": [
        "A public business/service website",
        "A server-owned service/package catalogue",
        "A bounded API or equivalent intake mechanism",
        "An owner contact/review path",
        "A proven payment provider for any published checkout path",
        "Explicit repository/site mutation authority before technical work",
        "Public discovery and outside-in verification capability"
      ],
      "boundaries": [
        "Discovery or job receipt does not grant repository or production access",
        "Caller-supplied prices, currencies or provider price identifiers are rejected",
        "Custom work remains quote-first when no authoritative published price exists",
        "Payment acceptance is not proof of technical completion or business outcome",
        "Unsupported payment providers must not be advertised as configured",
        "A successful intake request is not owner acceptance"
      ],
      "tags": [
        "agent-subcontracting",
        "agent-commerce",
        "structured-intake",
        "stripe",
        "server-authoritative-pricing",
        "quote-first",
        "authority-boundaries",
        "outside-in-verification"
      ],
      "sourcePath": "products/agent-subcontracting-commercial-handoff/SKILL.md"
    },
    {
      "id": "autonomous-coding-workflow",
      "slug": "autonomous-coding-workflow",
      "name": "Autonomous Coding Workflow with a Work Ledger",
      "productType": "prompt",
      "category": "agent-workflows",
      "summary": "Build a resumable coding-agent workflow that selects bounded work from repository evidence, persists decisions in a durable ledger, verifies work before completion, and stops at explicit approval boundaries.",
      "problem": "Long-running coding agents can lose durable task state, repeat completed work, broaden scope, or claim completion without repository-owned evidence.",
      "coreOutcomes": [
        "Repository-owned work selection and state",
        "Durable work ledger and resumability",
        "Explicit permission and approval boundaries",
        "Validation and evidence before completion",
        "Duplicate-work prevention"
      ],
      "requirements": [
        "Existing Git repository",
        "Node.js 20+ or equivalent scripting runtime",
        "Test runner and validation commands",
        "Roadmap or backlog stored in the repository",
        "Durable Markdown, JSON, or SQL work ledger",
        "Explicit permissions for mutation and external actions",
        "Git state inspection",
        "Evidence-pack storage"
      ],
      "boundaries": [
        "Not a general autonomous daemon",
        "Chat history is not authoritative workflow state",
        "Autonomy does not imply permission to deploy, push, publish, or expand scope"
      ],
      "tags": [
        "coding-agent",
        "work-ledger",
        "resumability",
        "verification",
        "approval-boundaries"
      ],
      "sourcePath": "products/autonomous-coding-workflow/PROMPT.md"
    },
    {
      "id": "bounded-google-docs-read-recovery",
      "slug": "bounded-google-docs-read-recovery",
      "name": "Bounded Google Docs Read Recovery",
      "productType": "skill",
      "category": "developer-workflows",
      "summary": "Diagnose Google Docs reader failures across network routes, OAuth refresh, Drive metadata and bounded document responses, then verify a compact-response repair without weakening document integrity checks.",
      "problem": "A document reader can hide distinct transport, authentication, response-size and validation failures behind one error, while a zero process exit or successful preview can be mistaken for a repaired live collector.",
      "coreOutcomes": [
        "Layered diagnosis tied to the actual host and running reader revision",
        "Conditional WSL route recovery with preserved configuration and guarded restarts",
        "Sanitised exception evidence and bounded token-refresh retries",
        "Compact Google Docs responses within the existing byte cap",
        "Preserved nested content, positions, revisions and metadata consistency checks",
        "Separate evidence for preview success, deployed revision and fresh saved observation"
      ],
      "requirements": [
        "An authorised Google document and an existing credential path",
        "Access to the application reader, its bounded-request contract and relevant diagnostics",
        "Actual host output or authorised access to the affected execution environment",
        "A preview or read-only execution path with explicit semantic results",
        "Relevant fixtures or validation commands for document structure and failure behavior",
        "Restart authority and a verified worker-drain procedure if a WSL configuration change is needed"
      ],
      "boundaries": [
        "Network configuration changes require route evidence and do not universally resolve WSL failures",
        "A WSL shutdown affects all running distributions and must account for their active work",
        "Retries remain bounded and confined to eligible transient token-refresh failures",
        "The existing response byte cap and document integrity checks remain in force",
        "Diagnostics exclude credentials, response bodies and private document contents",
        "Successful previews do not apply imports or document updates and may still write local authentication diagnostics",
        "Reviewed code, historical previews, installed revisions and saved observations are distinct evidence",
        "No live deployment, supply replenishment or downstream acceptance is guaranteed"
      ],
      "tags": [
        "google-docs",
        "oauth",
        "bounded-http",
        "wsl-networking",
        "diagnostics",
        "document-integrity",
        "runtime-verification"
      ],
      "sourcePath": "products/bounded-google-docs-read-recovery/SKILL.md"
    },
    {
      "id": "bounded-solo-maintainer-release",
      "slug": "bounded-solo-maintainer-release",
      "name": "Bounded Solo-Maintainer Release",
      "productType": "skill",
      "category": "agent-operations",
      "summary": "Execute an explicitly owner-authorised release under a narrow recorded solo-maintainer exception while preserving exact-head checks, protected merge, rollback and runtime evidence.",
      "problem": "A sole maintainer can be blocked by a non-author review rule, while informal workarounds risk inventing approval or silently weakening release and target-system boundaries.",
      "coreOutcomes": [
        "Explicit owner authority and a bounded policy exception",
        "Technical review distinguished from independent approval and formal scanning",
        "Exact candidate, merged tree and deployed revision reconciliation",